"idx","provider_name","center_type","phone","address_1","address_2","address_3"
192,"carilion clinic adult care center","mda care affiliate","5402245170","3 riverside circle","3rd floor","roanoke; va 24016"
193,"carilion clinic pediatric care center","mda care affiliate","5409858454","102 highland avenue","suite 104","roanoke; va 24013"
194,"st. charles medical center","affiliated clinic","5413823344","2200 ne neff rd.","suite 200","bend; or 97701"
195,"oregon neurology","mda clinic","5418689430","1 hayden bridge way",NA,"springfield; or 97477"
196,"valley children’s hospital","mda care center","5593536215","41169 goodwin way",NA,"madera; ca 93636"
197,"community regional medical center","mda care affiliate","5594592396","2335 e. kashian lane","suite 301","fresno; ca 93701"
198,"rancho los amigos national rehabilitation center","mda clinic","5624017111","7601 e. imperial highway",NA,"downey; ca 90242"
199,"als clinic at geisinger medical center","affiliated clinic","5702716472","100 north academy ave.",NA,"danville; pa 17822"
200,"geisinger medical center","mda care center","5702717994","100 n. academy avenue","1st floor d1","danville; pa 17822"
201,"geisinger medical center als clinic","recognized treatment center","5704161867","549 fair st.",NA,"bloomsburg; pa 17815"
202,"geisinger wyoming valley","mda care center","5708086028","620 baltimore dr",NA,"wilkes-barre; pa 18702"
203,"saint francis medical center","affiliated clinic","5736513188","211 st. francis dr.",NA,"cape girardeau; mo 63703"
204,"university of missouri- adult care center","mda care center","5738821515","1020 hitt street","3rd floor","columbia; mo 65201"
205,"university of missouri- pediatric care center","mda care center","5738826921","404 n. keene street","1st floor","columbia; mo 65201"
206,"university of missouri healthcare als treatment center","certified treatment center of excellence","5738840994","1020 hitt st.",NA,"columbia; mo 65212"
207,"elkhart clinic llc","mda care affiliate","5742963282","303 s. nappanee",NA,"elkhart; in 46514"
208,"strong memorial hospital","affiliated clinic","5852752559","601 elmwood avenue",NA,"rochester; ny 14642"
209,"university of mississippi","mda care center","6019845500","350 w. woodrow wilson",NA,"jackson; ms 39213"
210,"carl t. hayden veterans affairs medical center","veterans administration","6022775551","650 e. indian school",NA,"phoenix; az 85012"
211,"honor health neurology and phoenix neurological associates als clinic","certified treatment center of excellence","6023075842","7242 e. osborn road","suite 400","scottsdale; az 85251"
212,"gregory f. fulton als clinic at barrow neurological institute","certified treatment center of excellence","6024062704","240 w. thomas rd.","suite 400","phoenix; az 85013"
213,"phoenix children's hospital","mda care center","6029330970","1919 e. thomas road","3rd floor","phoenix; az 85016"
214,"the als center at dartmouth-hitchcock medical center","certified treatment center of excellence","6036505000","18 old etna rd.",NA,"lebanon; nh 03766"
215,"dartmouth-hitchcock medical center- adult care center","mda care center","6036505104","one medical center drive","suite 3-c","lebanon; nh 03756"
216,"dartmouth hitchcock medical center- pediatric care center","mda care center","6036539669","one medical center drive","6th floor","lebanon; nh 03756"
217,"dartmouth-hitchcock- manchester","mda care center","6036952940","87 mcgregor street","suite 2200","manchester; nh 03110"
218,"sanford clinic in sioux falls","mda care center","6053121000","1600 w. 22nd street",NA,"sioux falls; sd 57105"
219,"avera brain and spine institute","recognized treatment center","6053228993","800 e 21st st.",NA,"sioux falls; sd 57105"
220,"sioux falls va health system","veterans administration","6053363230","2501 w 22nd st.",NA,"sioux falls; sd 57117"
221,"dean neurological institute & spine center","mda care affiliate","6082603425","700 s. park street","3rd floor","madison; wi 53715"
222,"university of wisconsin health","mda care center","6082620547","600 highland avenue","h6-544","madison; wi 53792"
223,"uw health university hospital als clinic","affiliated clinic","6082635442","600 highland ave.",NA,"madison; wi 53792"
224,"american family children's hospital","mda care center","6082636420","1675 highland avenue",NA,"madison; wi 53792"
225,"gundersen health system als clinic","affiliated clinic","6087759000","1900 south ave.",NA,"la crosse; wi 54601"
226,"neuromuscular and als center for comprehensive care at lehigh valley hospital","recognized treatment center","6104028420","1210 s. cedar crest blvd.",NA,"allentown; pa 18103"
227,"good shepherd rehabilitation hospital","mda/als care center","6107763100","850 s. 5th street",NA,"allentown; pa 18103"
228,"university of minnesota","mda/als care center","6123656777","2512 s. 7th street","3rd floor","minneapolis; mn 55454"
229,"m health fairview als clinic","certified treatment center of excellence","6126266688","909 fulton st. se","3rd floor; mc 2121cj","minneapolis; mn 55455"
230,"minneapolis va health care system (vahcs) als center of excellence","certified treatment center of excellence","6126297005","one veteran's dr.",NA,"minneapolis; mn 55417"
231,"university of minnesota- twin cities","mda/als care center","6126727422","909 fulton street se","3rd floor","minneapolis; mn 55455"
232,"als center of excellence at hennepin healthcare","certified treatment center of excellence","6128735465","715 south 8th st.","3rd floor neurology clinic","minneapolis; mn 55415"
233,"ohio state university","mda/als care center","6142934969","543 taylor avenue",NA,"columbus; oh 43203"
234,"nationwide children's hospital","mda care center","6147222203","555 s 18th st",NA,"columbus; oh 43205"
235,"ohiohealth als clinic","certified treatment center of excellence","6147882445","300 polaris parkway","suite 2350","westerville; oh 43082"
236,"vanderbilt university","mda/als care center","6159360060","2200 pierce avenue",NA,"nashville; tn 37232"
237,"helen devos children's hospital","mda care center","6162672500","100 michigan street ne",NA,"grand rapids; mi 49503"
238,"spectrum health als multidisciplinary clinic","certified treatment center of excellence","6162677104","2750 e. beltline ne grand rapids; mi 49525",NA,"grand rapids; mi 49525"
239,"trinity health medical group-neuromuscular","certified treatment center of excellence","6166855050","220 cherry st.",NA,"grand rapids; mi 49503"
240,"boston children's hospital","mda care center","6173558235","300 longwood avenue","11th floor","boston; ma 02115"
241,"brigham & women's hospital","mda care center","6175257443","60 fenwood road","neuroscience 1st floor","boston; ma 02115"
242,"tufts medical center","mda care affiliate","6176365848","800 washington street",NA,"boston; ma 02111"
243,"massachusetts general hospital- pediatric care center","mda care center","6176434645","165 cambridge street","8th floor","boston; ma 02114"
244,"beth israel deaconess medical center","affiliated clinic","6176678130","330 brookline ave.",NA,"boston; ma 02215"
245,"sean m. healey & amg center for als","affiliated clinic","6177243914","15 parkman st.",NA,"boston; ma 02114"
246,"massachusetts general hospital","mda clinic","6177263642","boston; ma 02114",NA,NA
247,"uc san diego als center","certified treatment center of excellence","6195435300","200 west arbor dr.",NA,"san diego; ca 92103"
248,"stony brook university hospital als center","certified treatment center of excellence","6314444623","179 belle meade rd.","suite 3 east","setauket; ny 11733"
249,"stony brook children's hospital","mda care affiliate","6314445437","4 technology drive",NA,"east setauket; ny 11733"
250,"st. charles hospital and rehabilitation","mda care center","6314746300","200 belle terre road",NA,"port jefferson; ny 11777"
251,"als association program at the hospital for special surgery","certified treatment center of excellence","6467146135","525 east 71st st.",NA,"new york; ny 10021"
252,"hospital for special surgery","mda/als care center","6467978917","525 e. 71st street","5th floor","new york; ny 10021"
253,"veteran’s administration - palo alto","veterans administration","6504935000","3801 miranda ave.",NA,"palo alto; ca 94304"
254,"lucile packard children's hospital","mda care center","6507230993","730 welch road","2nd floor","palo alto; ca 94304"
255,"stanford mda/als neuroscience clinic","affiliated clinic","6507236469","213 quarry rd.","1st floor","palo alto; ca 94304"
256,"gillette children's specialty healthcare","mda care center","6512908707","200 e. university avenue",NA,"st. paul; mn 55101"
257,"healthpartners neuroscience center","affiliated clinic","6514956307","295 phalen blvd.",NA,"st. paul; mn 55130"
258,"cook children's medical center","mda care center","6828852500","1500 cooper street","4th floor","fort worth; tx 76104"
259,"sanford coordinated treatment center","mda care center","7012346600","736 broadway rt 1049",NA,"fargo; nd 58122"
260,"roseman university als clinic","affiliated clinic","7024634040","5380 s. rainbow","ste 120","las vegas; nv 89118"
261,"las vegas clinic – als clinic","affiliated clinic","7025054230","351 n. buffalo dr.","suite b","las vegas; nv 89145"
262,"carolinas medical center","mda clinic","7044461900","1010 edgehill road north",NA,"charlotte; nc 28207"
263,"atrium health als center","affiliated clinic","7044466254","university of north carolina school of medicine – charlotte campus","1010 edgehill rd.","north charlotte; nc 28207"
264,"augusta university als clinic","certified treatment center of excellence","7067212681","1120 15th st.",NA,"augusta; ga 30912"
265,"macon als clinic","affiliated clinic","7067214581","3351 northside dr.",NA,"macon; ga 31210"
266,"edward hines- jr. va als multidisciplinary clinic","veterans administration","7082028387","5000 s. 5th ave.","bld 228 neurology; 5th floor","hines; il 60141"
267,"houston methodist neurological institute","mda/als care center","7133637310","6560 fannin street","suite 802","houston; tx 77030"
268,"houston methodist als clinic","certified treatment center of excellence","7134413760","6560 fannin","suite 802","houston; tx 77030"
269,"baylor college of medicine","mda clinic","7137982273","7200 cambridge street suite 9a",NA,"houston; tx 77030"
270,"baylor college of medicine","certified treatment center of excellence","7137987411","6550 fannin st.","suite 1801 (smith tower)","houston; tx 77030"
271,"uc irvine als clinic","certified treatment center of excellence","7144562332","200 s. manchester","suite 110","orange; ca 92868"
272,"children's hospital of orange county","mda care center","7145097981","501 s. main street","suite 350","orange; ca 92868"
273,"dent neurologic institute","affiliated clinic","7162502000","3980 sheridan drive",NA,"buffalo; ny 14226"
274,"university of buffalo","mda care center","7169326080","1001 main street",NA,"buffalo; ny 14203"
275,"penn state hershey medical center","mda care center","7175313828","30 hope drive","suite 1300","hershey; pa 17033"
276,"suny downstate medical center","mda care center","7182707207","450 clarkson avenue",NA,"brooklyn; ny 11203"
277,"suny downstate at maimonides medical center","mda care center","7182837470","6323 7th ave",NA,"brooklyn; ny 11220"
278,"montefiore medical center","mda care center","7184058140","1515 blondell ave.","suite 220","bronx; ny 10461"
279,"als association clinic program at the james j. peters va medical center","veterans administration","7185849000","130 west kingsbridge rd.","jjpvamc room 5c-02; 5th floor","bronx; ny 10468"
280,"children's hospital of colorado","mda care center","7207772806","13123 e. 16th avenue",NA,"aurora; co 80045"
281,"university of colorado","affiliated clinic","7208482080","12605 e. 16th ave.",NA,"aurora; co 80045"
282,"st. anthony's neurology group","mda care center","7278207701","1201 5th avenue north","medical office building suite 202","st. petersburg; fl 33705"
283,"rutgers robert wood johnson medical school","certified treatment center of excellence","7322357733","125 paterson st.","clinical academic bldg.; suite 6100","new brunswick; nj 08903"
284,"hackensack meridian jersey shore university medical center als center","certified treatment center of excellence","7327763307","2100 corlies avenue","suite 2","neptune; nj 07753"
285,"university of michigan- pediatric rehabilitation center","mda care center","7349364179","2205 commonwealth blvd",NA,"ann arbor; mi 48105"
286,"university of michigan- adult","mda care center","7349369006","325 e eisenhower pkwy","suite 100","ann arbor; mi 48108"
287,"the university of michigan health system","certified treatment center of excellence","7349369020","1500 east medical center dr. ann arbor; mi 48109",NA,"ann arbor; mi 48109"
288,"sentara als clinic","affiliated clinic","7575070600","1950 glenn mitchell dr.","suite 200","virginia beach; va 23456"
289,"the riverside als clinic","affiliated clinic","7576377500","850 enterprise parkway; ste. 1400",NA,"hampton; va 23666"
290,"children's hospital of the kings daughters","mda care center","7576686494","850 southampton avenue","neurology 1st floor","norfolk; va 23510"
291,"maple grove clinic","mda clinic","7638981080","14500 99th avenue north",NA,"maple grove; mn 55369"
292,"shriners hospital for children- chicago","mda care center","7736225400","2211 n. oak park avenue",NA,"chicago; il 60707"
293,"the university of chicago","certified treatment center of excellence","7737025659","5841 s. maryland ave.","mc 2030","chicago; il 60637"
294,"st mary’s medical group als clinic","affiliated clinic","7757703554","645 n. arlington ave.","suite 655","reno; nv 89503"
295,"lahey clinic","mda care affiliate","7817445100","41 burlington mall road",NA,"burlington; ma 01805"
296,"the curt and shonda schilling als clinic at lahey hospital and medical center","certified treatment center of excellence","7817447273","41 mall rd.",NA,"burlington; ma 01805"
297,"instituto de rehabilitación del caribe","mda care center","7875047554","264 calle convento",NA,"san juan; pr 00911"
298,"university of puerto rico","mda care center","7877587910","1101-1113 cll 56 se",NA,"san juan; pr 00921"
299,"ponce health sciences university","mda care center","7878400052","388 zona ind reparada 2",NA,"ponce; pr 00716"
300,"oregon health and sciences university als clinic","certified treatment center of excellence","8002456478","3181 sw sam jackson park rd.","cr120","portland; or 97239"
301,"richard r. dart als clinic","certified treatment center of excellence","8002513627","university hospital","1221 lee st.; fourth floor","charlottesville; va 22908"
302,"penn state hershey als clinic and research center","certified treatment center of excellence","8002923332","30 hope dr.",NA,"hershey; pa 17033"
303,"sanford health neuroscience","affiliated clinic","8004374010","736 broadway",NA,"fargo; nd 58122"
304,"marshfield clinic","mda care affiliate","8006993377","1000 n. oak avenue",NA,"marshfield; wi 54449"
305,"jim ""catfish"" hunter als clinic","recognized treatment center","8007754840","outpatient rehab building","2310 stantonsburg rd.","greenville; nc 27835"
306,"kaiser permanente als clinic - la","recognized treatment center","8009548000","1505 n. edgemont st.","5th floor","los angeles; ca 90027"
307,"university of utah mnd clinic","certified treatment center of excellence","8015856052","175 n. medical dr.","5th floor","salt lake city; ut 84132"
308,"university of utah medical center","mda/als care center","8015857575","175 n. medical drive east","4th floor","salt lake city; ut 84132"
309,"university of vermont medical center als clinic","certified treatment center of excellence","8028474589","790 college parkway",NA,"colchester; vt 05401"
310,"children's hospital of richmond","mda care center","8046285804","1000 e. broad street","3rd floor room 3-336","richmond; va 23298"
311,"virginia commonwealth university als clinic","affiliated clinic","8048280371","11958 w. broad st.",NA,"henrico; va 23233"
312,"virginia commonwealth university","mda care center","8048289350","11958 w. broad street","4th floor","richmond; va 23233"
313,"kaiser permanente als clinic - honolulu","affiliated clinic","8084328000","3288 moanalua rd.","4th floor; neurology","honolulu; hi 96819"
314,"neurology associates- honolulu","mda clinic","8085235886","321 n. kuakini street",NA,"honolulu; hi 96817"
315,"university of south florida als clinic","certified treatment center of excellence","8139749273","13330 laurel dr.",NA,"tampa; fl 33612"
316,"conemaugh health system als clinic","affiliated clinic","8142695061","1450 scalp ave.","suite 120","johnstown; pa 15904"
317,"upmc northshore neurosciences","mda clinic","8148774600","120 e. 2nd street","3rd floor","erie; pa 16507"
318,"upmc northshore neurology","affiliated clinic","8148778000","120 e 2nd st.","3rd floor","erie; pa 16507"
319,"methodist neurology associates","mda care affiliate","8172250410","2800 e. broad street","suite 421","mansfield; tx 76063"
320,"olive view medical center","mda care center","8183643104","14445 olive view drive",NA,"sylmar; ca 91342"
321,"texas children's hospital","mda care center","8328223554","6701 fannin street","9th floor","houston; tx 77030"
322,"ralph h. johnson vamc als clinic","veterans administration","8435775011","109 bee st.",NA,"charleston; sc 29401"
323,"medical university of south carolina","certified treatment center of excellence","8437923223","135 rutledge ave.",NA,"charleston; sc 29425"
324,"kaiser permanente als clinic - woodland hills","affiliated clinic","8558920919","5601 de soto avenue",NA,"woodland hills; ca 91367"
325,"va boston healthcare system","veterans administration","8573646964","150 south huntington avenue",NA,"jamaica plain; ma 02130"
326,"university of california- san diego- adult care center","mda/als care center","8586578540","4510 executive drive","suite 325","san diego; ca 92121"
327,"rady children's hospital","mda care center","8589668108","8001 frost street","3rd floor","san diego; ca 92123"
328,"university of kentucky","certified treatment center of excellence","8592185061","740 south limestone st.",NA,"lexington; ky 40536"
329,"the neuromuscular center at hospital for special care","certified treatment center of excellence","8608274924","2150 corbin ave.",NA,"new britain; ct 06053"
330,"connecticut children's medical center - farmington","mda care center","8608377500","505 farmington avenue","2nd floor","farmington; ct 06032"
331,"greenville health system als clinic","recognized treatment center","8644544500","200 patewood dr.","suite b350","greenville; sc 29615"
332,"greenville hospital system pediatric care center","mda clinic","8645738732","249 n. grove medical park drive",NA,"spartanburg; sc 29303"
333,"northshore university health system","affiliated clinic","8775707020","2100 pfingsten rd.",NA,"glenview; il 60026"
334,"wesley neurology","mda/als care center","9012613500","8000 centerview parkway","suite 305","cordova; tn 38018"
335,"methodist le bonheur community outreach","mda care center","9012876265","600 jefferson ave",NA,"memphis; tn 38105"
336,"the als clinic of the midsouth","affiliated clinic","9017544425","1365 s germantown rd",NA,"germantown; tn 38138"
337,"uf health jacksonville multidisciplinary als clinic","certified treatment center of excellence","9042449922","580 west 8th st.","tower 1; 9th floor","jacksonville; fl 32209"
338,"mayo clinic florida","certified treatment center of excellence","9049532000","4500 san pablo rd. south",NA,"jacksonville; fl 32224"
339,"mayo clinic- jacksonville","mda/als care center","9049536869","4500 san pablo road south","2nd floor","jacksonville; fl 32224"
340,"kaiser permanente als clinic - fontana","affiliated clinic","9094275416","9985 sierra ave.",NA,"fontana; ca 92335"
341,"the center for restorative neurology at loma linda university neurology","certified treatment center of excellence","9095585977","11370 anderson st.","suite 2400","loma linda; ca 92354"
342,"loma linda university - upland","mda clinic","9098351810","901 san bernardino road","suite 302","upland; ca 91786"
343,"university of kansas medical center","certified treatment center of excellence","9135880656","3599 rainbow blvd.","ms 2012","kansas city; ks 66160"
344,"university of kansas medical center","mda/als care center","9135886820","3599 rainbow blvd.",NA,"kansas city; ks 66103"
345,"white plains hospital and medical center","mda care affiliate","9146811128","41 east post rd.",NA,"white plains; ny 10601"
346,"texas tech university health sciences center el paso","affiliated clinic","9152155900","4801 alberta ave.",NA,"el paso; tx 79905"
347,"uc davis multidisciplinary als clinic","certified treatment center of excellence","9167346304","4860 y st.","suite 1700","sacramento; ca 95817"
348,"university of california- davis","mda/als care center","9167347041","4860 y street ste. 1700","department of physical medicine & rehabilitation","sacramento; ca 95817"
349,"neurology llpc of tulsa","mda care center","9187477517","1919 s. wheeling avenue","suite 707","tulsa; ok 74104"
350,"lennox baker children's hospital","mda clinic","9196136832","3000 erwin road",NA,"durham; nc 27705"
351,"duke university als center","certified treatment center of excellence","9196682875","932 morreene rd.","box 3333","durham; nc 27705"
352,"duke university","mda care center","9196815176","200 trent drive","clinic 1-l","durham; nc 27710"
353,"the als clinic at the university of north carolina at chapel hill","affiliated clinic","9198437857","194 finley gold course rd.","suite 200","chapel hill; nc 27517"
354,"university of north carolina","mda care center","9199669281","194 finley golf course road","suite 200","chapel hill; nc 27517"
355,"prevea health- pediatric care center","mda care center","9202721270","1821 s. webster avenue",NA,"green bay; wi 54301"
356,"prevea health- adult care center","mda care center","9202721610","1821 s. webster avenue",NA,"green bay; wi 54301"
357,"children's hospital of wisconsin- fox valley","mda care center","9209697900","130 2nd st","west pavillion","neenah; wi 54956"
358,"kaiser permanente als clinic - martinez","affiliated clinic","9253721768","200 muir rd.","martinez; ca 94553","joanna dearlove m.d."
359,"sarasota memorial health care system - center for neuromuscular disorders","affiliated clinic","9419178900","5880 rand blvd.","ste. 209","sarasota; fl 34239"
360,"kaiser permanente als clinic - riverside","affiliated clinic","9513534360","neurology department","10800 magnolia ave.","riverside; ca 92505"
361,"phil smith neuroscience institute als clinic & research center at holy cross health","certified treatment center of excellence","9545423436","1931 ne 47th street",NA,"fort lauderdale; fl 33308"
362,"doctors' hospital at renaissance","affiliated clinic","9563622440","2821 michael angelo dr.","ste. 306","edinburg; tx 78539"
363,"rutgers university hospital","mda clinic","9739720977","90 bergen street suite 8100",NA,"newark; nj 07103"
364,"vanderbilt university medical center als clinic","affiliated clinic","6159360060","1211 medical center drive",NA,"nashville; tn 37232"
